{
  "edition_id": "ED-PB-001",
  "channel": "KDP",
  "trim_width_in": 6.0,
  "trim_height_in": 9.0,
  "page_count": 200,
  "binding": "perfect_bound",
  "template_source": "KDP current template",
  "template_generated_at": "2026-10-10",
  "pagination_lock_id": "PAG-LOCK-001",
  "isbn": "9780306406157"
}
